{"run": 40, "commit": "07deef0", "metric": 245851, "metrics": {"compress_µs": 240870, "decompress_µs": 4981, "ratio": 0.305825}, "status": "keep", "description": "Iterative DP (2-pass): static prices → Huffman → real prices → final. Ratio 0.308→0.306 (-0.8%). Properly guided DP finds better parse.", "timestamp": 1773447123677, "segment": 1, "agent": "claude-code", "model": "claude-opus-4-6"}
{"run": 41, "commit": "07deef0", "metric": 298586, "metrics": {"compress_µs": 293511, "decompress_µs": 5075, "ratio": 0.305425}, "status": "discard", "description": "12 length candidates in DP — only 0.1% ratio gain for 22% slower compress. 8 points is close to optimal.", "timestamp": 1773447173689, "segment": 1, "agent": "claude-code", "model": "claude-opus-4-6"}
{"run": 42, "commit": "07deef0", "metric": 268878, "metrics": {"compress_µs": 263975, "decompress_µs": 4903, "ratio": 0.305386}, "status": "discard", "description": "MAX_CHAIN=48 and 64 — diminishing returns (0.3054 vs 0.3058). Longer chains not worth the cost with DP.", "timestamp": 1773447229932, "segment": 1, "agent": "claude-code", "model": "claude-opus-4-6"}
{"run": 43, "commit": "07deef0", "metric": 250338, "metrics": {"compress_µs": 245363, "decompress_µs": 4975, "ratio": 0.305837}, "status": "discard", "description": "Explicit RLE (distance=1) in DP — no improvement, hash chain already finds these matches", "timestamp": 1773447295450, "segment": 1, "agent": "claude-code", "model": "claude-opus-4-6"}
{"run": 44, "commit": "07deef0", "metric": 318896, "metrics": {"compress_µs": 313848, "decompress_µs": 5048, "ratio": 0.305552}, "status": "discard", "description": "3-pass iterative DP — 3rd pass adds only 0.02% ratio gain. 2 passes already converge.", "timestamp": 1773447358410, "segment": 1, "agent": "claude-code", "model": "claude-opus-4-6"}
{"run": 45, "commit": "07deef0", "metric": 266077, "metrics": {"compress_µs": 261163, "decompress_µs": 4914, "ratio": 0.30557}, "status": "discard", "description": "Dual-match finder (best + nearest dist<256) — near matches rarely beat longest after price eval. No ratio gain.", "timestamp": 1773447440935, "segment": 1, "agent": "claude-code", "model": "claude-opus-4-6"}
{"run": 46, "commit": "97da45b", "metric": 236477, "metrics": {"compress_µs": 231375, "decompress_µs": 5102, "ratio": 0.311068}, "status": "discard", "description": "64KB window (65535, not power-of-2!) — bitmask broken, cache pressure, ratio worse 0.306→0.311", "timestamp": 1773448305960, "segment": 1, "agent": "claude-code", "model": "claude-opus-4-6", "idea_from": "gpt-5.4 (codex)"}
{"run": 47, "commit": "97da45b", "metric": 260238, "metrics": {"compress_µs": 255216, "decompress_µs": 5022, "ratio": 0.305936}, "status": "discard", "description": "Block splitting (8K and 64K tokens) — header overhead cancels coding gain. Homogeneous files don't benefit from per-block tables.", "timestamp": 1773448600864, "segment": 1, "agent": "claude-code", "model": "claude-opus-4-6", "idea_from": "gpt-5.4 (codex)"}
{"type":"config","name":"lz77-advanced-techniques","metricName":"ratio","metricUnit":"","bestDirection":"lower"}
{"run": 1, "commit": "0355e5c", "metric": 0.291847, "metrics": {"compress_µs": 378415, "decompress_µs": 6072, "total_µs": 384487}, "status": "keep", "description": "Baseline: LZ77+Huffman+DP iterative (12 files, 3.46MB). Target: improve ratio using Brotli/PAQ techniques.", "timestamp": 1773450885387, "segment": 2, "agent": "claude-code", "model": "claude-opus-4-6"}
{"type":"config","name":"lz77-wave4","metricName":"ratio","metricUnit":"","bestDirection":"lower"}
{"run": 1, "commit": "ba72f50", "metric": 0.220861, "metrics": {"compress_µs": 3937272, "decompress_µs": 14750, "total_µs": 3952022}, "status": "keep", "description": "Wave 4 baseline: SA+hash chain, block DP, Huffman/rANS try-both, 9 ctx, 8MB window.", "timestamp": 1791028457071, "segment": 3, "agent": "claude-code", "model": "claude-opus-5-5"}
{"run": 2, "commit": "554b428", "metric": 0.220661, "metrics": {"compress_µs": 3790563, "decompress_µs": 14502, "total_µs": 3805065}, "status": "keep", "description": "Rep-aware dist freqs between DP passes (replay encoder REP0-3 state) + DP uses learned dist_prices[REP*] instead of hardcoded 2/3/4 bits. 0.220861→0.220661", "timestamp": 1791028512737, "segment": 3, "agent": "claude-code", "model": "claude-opus-5-5"}
{"run": 3, "commit": "554b428", "metric": 0.220661, "metrics": {"compress_µs": 3829600, "decompress_µs": 14707, "total_µs": 3844307}, "status": "discard", "description": "Lower entropy price floor 1 bit→1/8 bit (clamp 32) — zero effect: last DP pass uses Huffman lengths; only kennedy uses rANS. ratio 0.220661 (unchanged)", "timestamp": 1791028778114, "segment": 3, "agent": "claude-code", "model": "claude-opus-5-5"}
{"run": 4, "commit": "adee83f", "metric": 0.218454, "metrics": {"compress_µs": 4429651, "decompress_µs": 36230, "total_µs": 4465881}, "status": "keep", "description": "LZMA-style adaptive binary range coder backend (12-state, matched literals, REP0-3, LZMA dist slots, lc/lp/pb tried from 8 sets) as 3rd try-all coder, no table header. 0.220661→0.218454 (-1.0%). Wins on plrabn/urls/geo/franko/fields/jpeg; Huffman still wins alice/asyoulik/cp, rANS kennedy.", "timestamp": 1791028778172, "segment": 3, "agent": "claude-code", "model": "claude-opus-5-5"}
{"run": 5, "commit": "aceda54", "metric": 0.21822, "metrics": {"compress_µs": 4402270, "decompress_µs": 36835, "total_µs": 4439105}, "status": "keep", "description": "LZMA backend PROB_BITS 11→12. 0.218454→0.218220", "timestamp": 1791028850840, "segment": 3, "agent": "claude-code", "model": "claude-opus-5-5"}
{"run": 6, "commit": "aceda54", "metric": 0.218359, "metrics": {"compress_µs": 4332191, "decompress_µs": 39805, "total_µs": 4371996}, "status": "discard", "description": "LZMA two-rate counters (avg fast+slow): 4/7→0.218687, 5/6→0.218435, 4/5→0.218359 — all worse than single shift 5 (0.218220)", "timestamp": 1791028999700, "segment": 3, "agent": "claude-code", "model": "claude-opus-5-5"}
{"run": 7, "commit": "bf99a21", "metric": 0.217503, "metrics": {"compress_µs": 4807669, "decompress_µs": 36351, "total_µs": 4844020}, "status": "keep", "description": "Refactor DP into dp_parse(Prices) + extra DP pass with LZMA-estimated prices (lc=3 ctx, is_match per ctx, bucketed len prices, slot prices, rep index prices); both parses tried with LZMA backend. 0.218220→0.217503, compress +19%", "timestamp": 1791029384447, "segment": 3, "agent": "claude-code", "model": "claude-opus-5-5"}
{"run": 8, "commit": "56d876e", "metric": 0.217261, "metrics": {"compress_µs": 5332549, "decompress_µs": 36860, "total_µs": 5369409}, "status": "keep", "description": "Second LZMA-priced DP pass, stats re-estimated from 1st LZMA parse. 0.217503→0.217261, compress +11%", "timestamp": 1791029439549, "segment": 3, "agent": "claude-code", "model": "claude-opus-5-5"}
{"run": 9, "commit": "56d876e", "metric": 0.217291, "metrics": {"compress_µs": 5385076, "decompress_µs": 39682, "total_µs": 5424758}, "status": "discard", "description": "Huffman DP passes 4→3 for <500KB (LZMA passes still 2): ratio 0.217291 (worse), compress time unchanged — DP not the bottleneck", "timestamp": 1791029517236, "segment": 3, "agent": "claude-code", "model": "claude-opus-5-5"}
{"run": 10, "commit": "cb30161", "metric": 0.21396, "metrics": {"compress_µs": 6394260, "decompress_µs": 75964, "total_µs": 6470224}, "status": "keep", "description": "LZMA backend literal coding via lpaq-style integer logistic mixer: inputs = LZMA lit prob (incl. matched literal), order-1 full-byte ctr, hashed order-2 ctr, bias; 16 weight sets (bitpos × matched). Decoder normalize if→while (p can reach 1/4096). 0.217261→0.213960 (-1.5%), beats brotli-11 (0.2167) and xz (0.2156). compress +20%, decompress 37→76ms", "timestamp": 1791029706071, "segment": 3, "agent": "claude-code", "model": "claude-opus-5-5"}
{"run": 11, "commit": "92ff7cd", "metric": 0.213954, "metrics": {"compress_µs": 5164089, "decompress_µs": 67699, "total_µs": 5231788}, "status": "keep", "description": "LZMA param sets 8→4: lc∈{0,1,2,3}, lp=pb=0 (pb/lp never won). 0.213960→0.213954, compress 6.39→5.16s", "timestamp": 1791029801897, "segment": 3, "agent": "claude-code", "model": "claude-opus-5-5"}
{"run": 12, "commit": "856708a", "metric": 0.213874, "metrics": {"compress_µs": 5018327, "decompress_µs": 63904, "total_µs": 5082231}, "status": "keep", "description": "Literal ctr limit sweep 30/60/127/255/1020 → 1020 best (more stationary). MIX_LR sweep 2/4/6/10/16 → 6 stays best. 0.213954→0.213874", "timestamp": 1791030167050, "segment": 3, "agent": "claude-code", "model": "claude-opus-5-5"}
{"run": 13, "commit": "9d9242f", "metric": 0.2137, "metrics": {"compress_µs": 5195953, "decompress_µs": 76243, "total_µs": 5272196}, "status": "keep", "description": "Literal mixer: + hashed order-3 counter input (5 inputs). 0.213874→0.213700. Small files (fields/cp) slightly worse, text better.", "timestamp": 1791030249239, "segment": 3, "agent": "claude-code", "model": "claude-opus-5-5"}
{"run": 14, "commit": "a77a598", "metric": 0.209988, "metrics": {"compress_µs": 6276541, "decompress_µs": 104867, "total_µs": 6381408}, "status": "keep", "description": "LZMA DP passes price literals per position: shadow pass of the adaptive literal mixer over the whole input (trained only on previous parse's literal positions, lc=2, no matched side-info) + per-ctx is_match0 cost. 0.213700→0.209988 (-1.74%). alice 0.318→0.309, plrabn 0.346→0.334. kennedy back to rANS, geo +0.1%. compress +21%", "timestamp": 1791030342777, "segment": 3, "agent": "claude-code", "model": "claude-opus-5-5"}
{"run": 15, "commit": "38a5810", "metric": 0.209988, "metrics": {"compress_µs": 5888095, "decompress_µs": 116086, "total_µs": 6004181}, "status": "keep", "description": "Probe: Huffman-parse stream never wins under LZMA backend, lc=1 never wins → encode only LZMA parse with lc∈{0,2,3}. Ratio unchanged 0.209988, compress 6.28→5.89s", "timestamp": 1791030603257, "segment": 3, "agent": "claude-code", "model": "claude-opus-5-5"}
{"run": 16, "commit": "e70d148", "metric": 0.209831, "metrics": {"compress_µs": 5665070, "decompress_µs": 108105, "total_µs": 5773175}, "status": "keep", "description": "Shadow literal-cost pass uses matched-literal side info (rep0 = dist of previous-parse match ending at i). 0.209988→0.209831. kennedy still rANS (LZMA 48398 vs 48360).", "timestamp": 1791030668575, "segment": 3, "agent": "claude-code", "model": "claude-opus-5-5"}
{"run": 17, "commit": "4ef5052", "metric": 0.208793, "metrics": {"compress_µs": 5516329, "decompress_µs": 107834, "total_µs": 5624163}, "status": "keep", "description": "LZMA DP: is_match and rep-index/normal selection prices split by state (prev token literal vs match, from prev_info MSB) like the coder's is_match[state]/is_rep[state]. 0.209831→0.208793 (-0.5%)", "timestamp": 1791030768033, "segment": 3, "agent": "claude-code", "model": "claude-opus-5-5"}
{"run": 18, "commit": "753bc95", "metric": 0.208512, "metrics": {"compress_µs": 6220198, "decompress_µs": 147049, "total_µs": 6367247}, "status": "keep", "description": "APM/SSE after literal mixer, ctx=(prev byte,node), 33 interpolated bins, rate 7, final=(mix+3apm)/4. 0.208793→0.208512. Variant ctx=node only: 0.208599 at same speed → full ctx kept. compress +14%, decompress 108→149ms", "timestamp": 1791030950492, "segment": 3, "agent": "claude-code", "model": "claude-opus-5-5"}
{"run": 19, "commit": "753bc95", "metric": 0.208605, "metrics": {"compress_µs": 6205665, "decompress_µs": 145945, "total_µs": 6351610}, "status": "discard", "description": "LZMA shortrep (is_rep0_long bit + DP option, prior weight on literal==rep0-byte opportunities 0.1/0.3/1.0): 0.208566/0.208605/0.208656, all worse than 0.208512 — matched-literal mixing already covers it; rep0long bit is pure overhead", "timestamp": 1791031192897, "segment": 3, "agent": "claude-code", "model": "claude-opus-5-5"}
{"run": 20, "commit": "5a88ce9", "metric": 0.208143, "metrics": {"compress_µs": 6506567, "decompress_µs": 166852, "total_µs": 6673419}, "status": "keep", "description": "Mixer weight set = bitpos × matched × confidence(6 buckets from o2/o3 ctr counts: unseen o2, unseen o3, n3<4, <16, <64, ≥64). 0.208512→0.208143, compress +5%", "timestamp": 1791031257269, "segment": 3, "agent": "claude-code", "model": "claude-opus-5-5"}
{"run": 21, "commit": "434a3fa", "metric": 0.208087, "metrics": {"compress_µs": 7180104, "decompress_µs": 186757, "total_µs": 7366861}, "status": "keep", "description": "Shadow literal-cost pass lc 2→0 (lc=3: 0.208170). 0.208143→0.208087", "timestamp": 1791031424257, "segment": 3, "agent": "claude-code", "model": "claude-opus-5-5"}
{"run": 22, "commit": "d823b75", "metric": 0.207372, "metrics": {"compress_µs": 7141439, "decompress_µs": 210283, "total_µs": 7351722}, "status": "keep", "description": "Literal mixer: + hashed order-4 ctr (6 inputs). 0.208087→0.207372 (-0.34%). plrabn 0.3291→0.3262, alice 0.3047→0.3034. decompress 210ms", "timestamp": 1791031513292, "segment": 3, "agent": "claude-code", "model": "claude-opus-5-5"}
{"run": 23, "commit": "6baace5", "metric": 0.204114, "metrics": {"compress_µs": 7983809, "decompress_µs": 338901, "total_µs": 8322710}, "status": "keep", "description": "Generic literal mixer: hashed ctx = o2,o3,o4,o6,word (8 inputs); nibble-slotted hashing (16-ctr slot per nibble = 1 cache line; 256-blocks wasted table: 0.2058, per-bit scatter 0.2044 but +69% time). lc trials {0,2} (lc=3 dropped), Huffman seed DP passes 4→2 (LZMA wins everywhere; also better seed). 0.207372→0.204114 (-1.57%). A/B same load: compress 6.50→8.03s (+23.6%), decompress ~0.36s", "timestamp": 1791032494980, "segment": 3, "agent": "claude-code", "model": "claude-opus-5-5"}
{"run": 24, "commit": "6a17166", "metric": 0.203881, "metrics": {"compress_µs": 8331556, "decompress_µs": 407014, "total_µs": 8738570}, "status": "keep", "description": "All LZMA binary probs (is_match, rep flags, len/slot trees, lit): 12-bit p + 4-bit count in u16; shift schedule 2,3,3,4,4,4,5… (fast start), p clamped [31,4065]. 0.204114→0.203881, every file better", "timestamp": 1791032620859, "segment": 3, "agent": "claude-code", "model": "claude-opus-5-5"}
{"run": 25, "commit": "44ccf37", "metric": 0.201847, "metrics": {"compress_µs": 8503778, "decompress_µs": 407563, "total_µs": 8911341}, "status": "keep", "description": "Length coders (match & rep) get context = bucket(prev match length: <4,<8,<16,≥16) via pos_state slot (pb=0 always). kennedy 47251→40142 (-15%). 0.203881→0.201847 (-1.0%)", "timestamp": 1791032758842, "segment": 3, "agent": "claude-code", "model": "claude-opus-5-5"}
{"run": 26, "commit": "3bf5930", "metric": 0.200138, "metrics": {"compress_µs": 8891706, "decompress_µs": 431473, "total_µs": 9323179}, "status": "keep", "description": "is_match ctx = state × (prev byte >> 5) (matches DP pricing ctx). 0.201847→0.200138 (-0.85%); berkut -2.8%, alice -0.9%", "timestamp": 1791032866902, "segment": 3, "agent": "claude-code", "model": "claude-opus-5-5"}
{"run": 27, "commit": "3bf5930", "metric": 0.200218, "metrics": {"compress_µs": 8675042, "decompress_µs": 420823, "total_µs": 9095865}, "status": "discard", "description": "Distance slot tree ctx: × (prev byte>>5) → 0.200303; × (state≥7) → 0.200218; both worse than 0.200138 (dilution)", "timestamp": 1791033027440, "segment": 3, "agent": "claude-code", "model": "claude-opus-5-5"}
{"run": 28, "commit": "499ea80", "metric": 0.199983, "metrics": {"compress_µs": 8671211, "decompress_µs": 427127, "total_µs": 9098338}, "status": "keep", "description": "Rep flags is_rep/g0/g1/g2 ctx = state × prev-length bucket. kennedy 39684→39139. 0.200138→0.199983 (first < 0.2)", "timestamp": 1791033108598, "segment": 3, "agent": "claude-code", "model": "claude-opus-5-5"}
{"type":"config","name":"lz77-wave5-parallel","metricName":"ratio","metricUnit":"","bestDirection":"lower"}
{"run": 1, "commit": "747439e", "metric": 0.199983, "metrics": {"compress_µs": 7962451, "decompress_µs": 366479, "total_µs": 8328930}, "status": "keep", "description": "Wave 5 baseline (= wave 4 best), measured serially on an idle machine", "timestamp": 1791053006000, "segment": 4, "agent": "claude-code", "model": "claude-opus-5-5", "lane": "orchestrator"}
{"run": 2, "commit": "aebdd7b", "metric": 0.199969, "metrics": {"compress_µs": 8743464, "decompress_µs": 429464, "total_µs": 9172928}, "status": "keep", "description": "lit_ctx forward word hash (= literal_costs)", "timestamp": 1791052284000, "segment": 4, "agent": "claude-code", "model": "claude-opus-5-5", "lane": "literal model (wave5-claude)"}
{"run": 3, "commit": "9d13048", "metric": 0.199897, "metrics": {}, "status": "keep", "description": "2nd APM order-2 x node, 2^16 rows; weights tried 2/3/3 .199945, 2/4/2 .199914, 1/5/2 .199897, 1/4/3 .199900; 2^18 rows .199898", "timestamp": 1791052671000, "segment": 4, "agent": "claude-code", "model": "claude-opus-5-5", "lane": "literal model (wave5-claude)"}
{"run": 4, "commit": "5a6116b", "metric": 0.19957, "metrics": {"compress_µs": 10160163, "decompress_µs": 555816, "total_µs": 10715979}, "status": "keep", "description": "2nd mixer weight bank by (prev byte, matched), avg in stretch domain", "timestamp": 1791052772000, "segment": 4, "agent": "claude-code", "model": "claude-opus-5-5", "lane": "literal model (wave5-claude)"}
{"run": 5, "commit": "afed390", "metric": 0.199448, "metrics": {"compress_µs": 10439818, "decompress_µs": 566367, "total_µs": 11006185}, "status": "keep", "description": "final 2-input mixer replaces average (16 sets, FIN_LR 2)", "timestamp": 1791052872000, "segment": 4, "agent": "claude-code", "model": "claude-opus-5-5", "lane": "literal model (wave5-claude)"}
{"run": 6, "commit": "78ba3ca", "metric": 0.19924, "metrics": {"compress_µs": 10380424, "decompress_µs": 529866, "total_µs": 10910290}, "status": "keep", "description": "sparse ctx bytes -2,-3 (NH=6)", "timestamp": 1791053100000, "segment": 4, "agent": "claude-code", "model": "claude-opus-5-5", "lane": "literal model (wave5-claude)"}
{"run": 7, "commit": "-", "metric": 0.199257, "metrics": {"compress_µs": 12682439, "decompress_µs": 659998, "total_µs": 13342437}, "status": "discard", "description": "7th sparse ctx bytes -3,-4", "segment": 4, "agent": "claude-code", "model": "claude-opus-5-5", "lane": "literal model (wave5-claude)"}
{"run": 8, "commit": "-", "metric": 0.199268, "metrics": {"compress_µs": 10921990, "decompress_µs": 578767, "total_µs": 11500757}, "status": "discard", "description": "7th sparse ctx bytes -1,-3", "segment": 4, "agent": "claude-code", "model": "claude-opus-5-5", "lane": "literal model (wave5-claude)"}
{"run": 9, "commit": "-", "metric": 0.199437, "metrics": {"compress_µs": 10132508, "decompress_µs": 504949, "total_µs": 10637457}, "status": "discard", "description": "final mixer sets x conf (144 sets)", "segment": 4, "agent": "claude-code", "model": "claude-opus-5-5", "lane": "literal model (wave5-claude)"}
{"run": 10, "commit": "-", "metric": 0.199287, "metrics": {"compress_µs": 11302104, "decompress_µs": 601631, "total_µs": 11903735}, "status": "discard", "description": "decaying mixer lr boost 10", "segment": 4, "agent": "claude-code", "model": "claude-opus-5-5", "lane": "literal model (wave5-claude)"}
{"run": 11, "commit": "1ed5e98", "metric": 0.199225, "metrics": {}, "status": "keep", "description": "decaying mixer lr boost 3", "timestamp": 1791053529000, "segment": 4, "agent": "claude-code", "model": "claude-opus-5-5", "lane": "literal model (wave5-claude)"}
{"run": 12, "commit": "-", "metric": 0.199196, "metrics": {}, "status": "discard", "description": "lr 5+5 (superseded by a later tuning step)", "segment": 4, "agent": "claude-code", "model": "claude-opus-5-5", "lane": "literal model (wave5-claude)"}
{"run": 13, "commit": "0e86fce", "metric": 0.19918, "metrics": {}, "status": "keep", "description": "lr 4+6", "timestamp": 1791053769000, "segment": 4, "agent": "claude-code", "model": "claude-opus-5-5", "lane": "literal model (wave5-claude)"}
{"run": 14, "commit": "-", "metric": 0.199181, "metrics": {"compress_µs": 11573564, "decompress_µs": 620998, "total_µs": 12194562}, "status": "discard", "description": "lr 3+8", "segment": 4, "agent": "claude-code", "model": "claude-opus-5-5", "lane": "literal model (wave5-claude)"}
{"run": 15, "commit": "d6c6ba4", "metric": 0.19918, "metrics": {"compress_µs": 11793240, "decompress_µs": 634182, "total_µs": 12427422}, "status": "keep", "description": "incremental Ctx tracker refactor [ratio-neutral refactor]", "timestamp": 1791053983000, "segment": 4, "agent": "claude-code", "model": "claude-opus-5-5", "lane": "literal model (wave5-claude)"}
{"run": 16, "commit": "140a2fc", "metric": 0.199147, "metrics": {"compress_µs": 12061221, "decompress_µs": 653462, "total_µs": 12714683}, "status": "keep", "description": "word bigram ctx NH=7", "timestamp": 1791053983000, "segment": 4, "agent": "claude-code", "model": "claude-opus-5-5", "lane": "literal model (wave5-claude)"}
{"run": 17, "commit": "-", "metric": 0.199055, "metrics": {"compress_µs": 13075037, "decompress_µs": 705359, "total_µs": 13780396}, "status": "discard", "description": "hash tables cap 2^23 (superseded by a later tuning step)", "segment": 4, "agent": "claude-code", "model": "claude-opus-5-5", "lane": "literal model (wave5-claude)"}
{"run": 18, "commit": "-", "metric": 0.198789, "metrics": {"compress_µs": 12933875, "decompress_µs": 666927, "total_µs": 13600802}, "status": "discard", "description": "hash tables x16 cap 2^24 (superseded by a later tuning step)", "segment": 4, "agent": "claude-code", "model": "claude-opus-5-5", "lane": "literal model (wave5-claude)"}
