{"run": 19, "commit": "-", "metric": 0.198701, "metrics": {"compress_µs": 13994195, "decompress_µs": 750615, "total_µs": 14744810}, "status": "discard", "description": "hash tables x32 cap 2^24 (superseded by a later tuning step)", "segment": 4, "agent": "claude-code", "model": "claude-opus-5-5", "lane": "literal model (wave5-claude)"}
{"run": 20, "commit": "b74a79d", "metric": 0.198664, "metrics": {"compress_µs": 12797761, "decompress_µs": 682585, "total_µs": 13480346}, "status": "keep", "description": "hash tables x64 cap 2^24", "timestamp": 1791054389000, "segment": 4, "agent": "claude-code", "model": "claude-opus-5-5", "lane": "literal model (wave5-claude)"}
{"run": 21, "commit": "993c5bf", "metric": 0.198489, "metrics": {"compress_µs": 13690201, "decompress_µs": 784150, "total_µs": 14474351}, "status": "keep", "description": "2-way check-tagged hash slots (tag in unused ctr 0)", "timestamp": 1791054633000, "segment": 4, "agent": "claude-code", "model": "claude-opus-5-5", "lane": "literal model (wave5-claude)"}
{"run": 22, "commit": "-", "metric": 0.19851, "metrics": {}, "status": "discard", "description": "tags + tables x16 (4x less mem)", "segment": 4, "agent": "claude-code", "model": "claude-opus-5-5", "lane": "literal model (wave5-claude)"}
{"run": 23, "commit": "-", "metric": 0.198596, "metrics": {}, "status": "discard", "description": "mixer set conf from o3/o6", "segment": 4, "agent": "claude-code", "model": "claude-opus-5-5", "lane": "literal model (wave5-claude)"}
{"run": 24, "commit": "fb0dc30", "metric": 0.198479, "metrics": {}, "status": "keep", "description": "per-order ctr limits [1020,1020,255,127,255,1020,127]", "timestamp": 1791054963000, "segment": 4, "agent": "claude-code", "model": "claude-opus-5-5", "lane": "literal model (wave5-claude)"}
{"run": 25, "commit": "-", "metric": 0.198488, "metrics": {}, "status": "discard", "description": "per-order ctr limits [1020,255,60,30,60,255,30]", "segment": 4, "agent": "claude-code", "model": "claude-opus-5-5", "lane": "literal model (wave5-claude)"}
{"run": 26, "commit": "-", "metric": 0.198538, "metrics": {}, "status": "discard", "description": "APM weights 2/4/2 after final mixer", "segment": 4, "agent": "claude-code", "model": "claude-opus-5-5", "lane": "literal model (wave5-claude)"}
{"run": 27, "commit": "-", "metric": 0.198658, "metrics": {"compress_µs": 14886397, "decompress_µs": 836450, "total_µs": 15722847}, "status": "discard", "description": "confidence-weighted extra inputs (MIX_N 2NH+3)", "segment": 4, "agent": "claude-code", "model": "claude-opus-5-5", "lane": "literal model (wave5-claude)"}
{"run": 28, "commit": "9b9e958", "metric": 0.198138, "metrics": {"compress_µs": 15378238, "decompress_µs": 812341, "total_µs": 16190579}, "status": "keep", "description": "3rd mixer bank by (node, matched), 3-input final mixer", "timestamp": 1791055473000, "segment": 4, "agent": "claude-code", "model": "claude-opus-5-5", "lane": "literal model (wave5-claude)"}
{"run": 29, "commit": "7a7e357", "metric": 0.198099, "metrics": {"compress_µs": 14458870, "decompress_µs": 854950, "total_µs": 15313820}, "status": "keep", "description": "banks as array NB=4, 4th bank by order-2 hash (1024)", "timestamp": 1791055607000, "segment": 4, "agent": "claude-code", "model": "claude-opus-5-5", "lane": "literal model (wave5-claude)"}
{"run": 30, "commit": "5451ef6", "metric": 0.198011, "metrics": {}, "status": "keep", "description": "4th bank by word hash (1024)", "timestamp": 1791055715000, "segment": 4, "agent": "claude-code", "model": "claude-opus-5-5", "lane": "literal model (wave5-claude)"}
{"run": 31, "commit": "-", "metric": 0.198031, "metrics": {"compress_µs": 14331436, "decompress_µs": 809206, "total_µs": 15140642}, "status": "discard", "description": "5th bank by order-2 hash", "segment": 4, "agent": "claude-code", "model": "claude-opus-5-5", "lane": "literal model (wave5-claude)"}
{"run": 32, "commit": "b46f201", "metric": 0.197938, "metrics": {"compress_µs": 14720329, "decompress_µs": 860043, "total_µs": 15580372}, "status": "keep", "description": "APM dual-bin weighted update (rate 7)", "timestamp": 1791056114000, "segment": 4, "agent": "claude-code", "model": "claude-opus-5-5", "lane": "literal model (wave5-claude)"}
{"run": 33, "commit": "-", "metric": 0.197998, "metrics": {}, "status": "discard", "description": "... APM rate 8", "segment": 4, "agent": "claude-code", "model": "claude-opus-5-5", "lane": "literal model (wave5-claude)"}
{"run": 34, "commit": "-", "metric": 0.19801, "metrics": {}, "status": "discard", "description": "... APM rate 6", "segment": 4, "agent": "claude-code", "model": "claude-opus-5-5", "lane": "literal model (wave5-claude)"}
{"run": 35, "commit": "-", "metric": 0.197908, "metrics": {"compress_µs": 15009967, "decompress_µs": 924932, "total_µs": 15934899}, "status": "discard", "description": "3rd APM (word x node), weights 1/4/2/1 (superseded by a later tuning step)", "segment": 4, "agent": "claude-code", "model": "claude-opus-5-5", "lane": "literal model (wave5-claude)"}
{"run": 36, "commit": "1cdb99f", "metric": 0.19789, "metrics": {}, "status": "keep", "description": "3rd APM weights 1/3/2/2", "timestamp": 1791056335000, "segment": 4, "agent": "claude-code", "model": "claude-opus-5-5", "lane": "literal model (wave5-claude)"}
{"run": 37, "commit": "f41621a", "metric": 0.197376, "metrics": {"compress_µs": 17306146, "decompress_µs": 1143674, "total_µs": 18449820}, "status": "keep", "description": "literal match model (MM_MIN 6)", "timestamp": 1791056527000, "segment": 4, "agent": "claude-code", "model": "claude-opus-5-5", "lane": "literal model (wave5-claude)"}
{"run": 38, "commit": "2d4e592", "metric": 0.197222, "metrics": {}, "status": "keep", "description": "MM_MIN 5", "timestamp": 1791056756000, "segment": 4, "agent": "claude-code", "model": "claude-opus-5-5", "lane": "literal model (wave5-claude)"}
{"run": 39, "commit": "-", "metric": 0.197225, "metrics": {}, "status": "discard", "description": "MM_MIN 4", "segment": 4, "agent": "claude-code", "model": "claude-opus-5-5", "lane": "literal model (wave5-claude)"}
{"run": 40, "commit": "-", "metric": 0.197374, "metrics": {"compress_µs": 17348112, "decompress_µs": 1099458, "total_µs": 18447570}, "status": "discard", "description": "5th bank by match-model state x bitpos", "segment": 4, "agent": "claude-code", "model": "claude-opus-5-5", "lane": "literal model (wave5-claude)"}
{"run": 41, "commit": "c6583ba", "metric": 0.197182, "metrics": {"compress_µs": 17688861, "decompress_µs": 1144594, "total_µs": 18833455}, "status": "keep", "description": "indirect order-2 ctx (NH=8)", "timestamp": 1791057051000, "segment": 4, "agent": "claude-code", "model": "claude-opus-5-5", "lane": "literal model (wave5-claude)"}
{"run": 42, "commit": "a1fb1af", "metric": 0.195084, "metrics": {}, "status": "keep", "description": "third LZMA-priced DP pass (0.195084)", "timestamp": 1791052340000, "segment": 4, "agent": "antigravity", "model": "gemini-3.8-flash-high", "lane": "is_match + match-side DP (wave5-gemini)"}
{"run": 43, "commit": "b9b4945", "metric": 0.191471, "metrics": {}, "status": "keep", "description": "fourth LZMA-priced DP pass (0.191471)", "timestamp": 1791052452000, "segment": 4, "agent": "antigravity", "model": "gemini-3.8-flash-high", "lane": "is_match + match-side DP (wave5-gemini)"}
{"run": 44, "commit": "e77064d", "metric": 0.189247, "metrics": {}, "status": "keep", "description": "logistic mixer on is_match (0.189247)", "timestamp": 1791052702000, "segment": 4, "agent": "antigravity", "model": "gemini-3.8-flash-high", "lane": "is_match + match-side DP (wave5-gemini)"}
{"run": 45, "commit": "a4b6532", "metric": 0.188997, "metrics": {}, "status": "keep", "description": "order-4 hash context in is_match mixer (0.188997)", "timestamp": 1791052855000, "segment": 4, "agent": "antigravity", "model": "gemini-3.8-flash-high", "lane": "is_match + match-side DP (wave5-gemini)"}
{"run": 46, "commit": "bd6fe9c", "metric": 0.188431, "metrics": {}, "status": "keep", "description": "lctx-conditioned length and rep pricing in DP (0.188431)", "timestamp": 1791053264000, "segment": 4, "agent": "antigravity", "model": "gemini-3.8-flash-high", "lane": "is_match + match-side DP (wave5-gemini)"}
{"run": 47, "commit": "423225c", "metric": 0.188429, "metrics": {}, "status": "keep", "description": "APM secondary symbol estimation on is_match (0.188429)", "timestamp": 1791053408000, "segment": 4, "agent": "antigravity", "model": "gemini-3.8-flash-high", "lane": "is_match + match-side DP (wave5-gemini)"}
{"run": 48, "commit": "94e872a", "metric": 0.187775, "metrics": {}, "status": "keep", "description": "256-context match/literal flag pricing in DP (0.187775)", "timestamp": 1791053591000, "segment": 4, "agent": "antigravity", "model": "gemini-3.8-flash-high", "lane": "is_match + match-side DP (wave5-gemini)"}
{"run": 49, "commit": "9dcf9cc", "metric": 0.187745, "metrics": {}, "status": "keep", "description": "Condition MatchMix APM on state >= 7 (0.187745)", "timestamp": 1791053725000, "segment": 4, "agent": "antigravity", "model": "gemini-3.8-flash-high", "lane": "is_match + match-side DP (wave5-gemini)"}
{"run": 50, "commit": "80b6229", "metric": 0.187727, "metrics": {}, "status": "keep", "description": "Add order-3 context to MatchMix (0.187727)", "timestamp": 1791053859000, "segment": 4, "agent": "antigravity", "model": "gemini-3.8-flash-high", "lane": "is_match + match-side DP (wave5-gemini)"}
{"run": 51, "commit": "436e3e8", "metric": 0.187274, "metrics": {}, "status": "keep", "description": "Condition DP st_lit and st_match on lctx (0.187274)", "timestamp": 1791054019000, "segment": 4, "agent": "antigravity", "model": "gemini-3.8-flash-high", "lane": "is_match + match-side DP (wave5-gemini)"}
{"run": 52, "commit": "8f79e7f", "metric": 0.187224, "metrics": {}, "status": "keep", "description": "Tune MatchMix APM rate to >> 6 (0.187224)", "timestamp": 1791054291000, "segment": 4, "agent": "antigravity", "model": "gemini-3.8-flash-high", "lane": "is_match + match-side DP (wave5-gemini)"}
{"run": 53, "commit": "2ca4406", "metric": 0.187211, "metrics": {}, "status": "keep", "description": "Tune MatchMix APM rate to >> 7 (0.187211)", "timestamp": 1791054407000, "segment": 4, "agent": "antigravity", "model": "gemini-3.8-flash-high", "lane": "is_match + match-side DP (wave5-gemini)"}
{"run": 54, "commit": "9555d19", "metric": 0.187204, "metrics": {}, "status": "keep", "description": "Tune MatchMix MMIX_LR to 5 (0.187204)", "timestamp": 1791054730000, "segment": 4, "agent": "antigravity", "model": "gemini-3.8-flash-high", "lane": "is_match + match-side DP (wave5-gemini)"}
{"run": 55, "commit": "886a7db", "metric": 0.187199, "metrics": {}, "status": "keep", "description": "Tune MatchMix MMIX_LR to 4 (0.187199)", "timestamp": 1791054840000, "segment": 4, "agent": "antigravity", "model": "gemini-3.8-flash-high", "lane": "is_match + match-side DP (wave5-gemini)"}
{"run": 56, "commit": "c94d554", "metric": 0.187035, "metrics": {}, "status": "keep", "description": "Add order-6 context to MatchMix (0.187035)", "timestamp": 1791055077000, "segment": 4, "agent": "antigravity", "model": "gemini-3.8-flash-high", "lane": "is_match + match-side DP (wave5-gemini)"}
{"run": 57, "commit": "b392487", "metric": 0.186995, "metrics": {}, "status": "keep", "description": "Add order-8 context to MatchMix (0.186995)", "timestamp": 1791055214000, "segment": 4, "agent": "antigravity", "model": "gemini-3.8-flash-high", "lane": "is_match + match-side DP (wave5-gemini)"}
{"run": 58, "commit": "7f20880", "metric": 0.186934, "metrics": {}, "status": "keep", "description": "Expand MatchMix o4, o6, o8 tables to 16384 entries (0.186934)", "timestamp": 1791055871000, "segment": 4, "agent": "antigravity", "model": "gemini-3.8-flash-high", "lane": "is_match + match-side DP (wave5-gemini)"}
{"run": 59, "commit": "65c0a5f", "metric": 0.186918, "metrics": {}, "status": "keep", "description": "Direct-index o2 and expand o3 to 16384 in MatchMix (0.186918)", "timestamp": 1791056007000, "segment": 4, "agent": "antigravity", "model": "gemini-3.8-flash-high", "lane": "is_match + match-side DP (wave5-gemini)"}
{"run": 60, "commit": "eb70e3f", "metric": 0.186902, "metrics": {}, "status": "keep", "description": "Tune Laplace prior weight to 4.0 in flag pricing (0.186902)", "timestamp": 1791056542000, "segment": 4, "agent": "antigravity", "model": "gemini-3.8-flash-high", "lane": "is_match + match-side DP (wave5-gemini)"}
{"run": 61, "commit": "b0ec104", "metric": 0.18688, "metrics": {}, "status": "keep", "description": "Tune Laplace prior weight to 6.0 in flag pricing (0.186880)", "timestamp": 1791056653000, "segment": 4, "agent": "antigravity", "model": "gemini-3.8-flash-high", "lane": "is_match + match-side DP (wave5-gemini)"}
{"run": 62, "commit": "75a3e1a", "metric": 0.186826, "metrics": {}, "status": "keep", "description": "Tune Laplace prior weight to 8.0 in flag pricing (0.186826)", "timestamp": 1791056761000, "segment": 4, "agent": "antigravity", "model": "gemini-3.8-flash-high", "lane": "is_match + match-side DP (wave5-gemini)"}
{"run": 63, "commit": "299d28f", "metric": 0.186805, "metrics": {}, "status": "keep", "description": "Tune Laplace prior weight to 9.0 in flag pricing (0.186805)", "timestamp": 1791056956000, "segment": 4, "agent": "antigravity", "model": "gemini-3.8-flash-high", "lane": "is_match + match-side DP (wave5-gemini)"}
{"run": 64, "commit": "-", "metric": 0.200201, "metrics": {"compress_µs": 8938546, "decompress_µs": 423046, "total_µs": 9361592}, "status": "discard", "description": "Match-length-conditioned slot prices [lib.rs: Prices::from_lzma_stats, dp_parse]", "segment": 4, "agent": "codex-cli", "model": "gpt-6.1-sol (reasoning high)", "lane": "distance modeling (wave5-codex)"}
{"run": 65, "commit": "-", "metric": 0.200134, "metrics": {"compress_µs": 8756774, "decompress_µs": 434919, "total_µs": 9191693}, "status": "discard", "description": "Previous-distance slot bucket context [lzma_coder.rs: encode/decode/distance_context; lib.rs: Prices::from_lzma_stats/dp_parse]", "segment": 4, "agent": "codex-cli", "model": "gpt-6.1-sol (reasoning high)", "lane": "distance modeling (wave5-codex)"}
{"run": 66, "commit": "769ef0d", "metric": 0.199833, "metrics": {"compress_µs": 8585393, "decompress_µs": 411445, "total_µs": 8996838}, "status": "keep", "description": "Two adaptive high residual bits per slot [lzma_coder.rs: Model/encode/decode; lib.rs: Prices::from_lzma_stats/dp_parse]", "segment": 4, "agent": "codex-cli", "model": "gpt-6.1-sol (reasoning high)", "lane": "distance modeling (wave5-codex)"}
{"run": 67, "commit": "769ef0d", "metric": 0.199685, "metrics": {"compress_µs": 9090388, "decompress_µs": 458178, "total_µs": 9548566}, "status": "keep", "description": "Four adaptive high residual bits per slot [lzma_coder.rs: DIST_TOP_BITS; matching generic DP distance prices]", "segment": 4, "agent": "codex-cli", "model": "gpt-6.1-sol (reasoning high)", "lane": "distance modeling (wave5-codex)"}
{"run": 68, "commit": "-", "metric": 0.199696, "metrics": {"compress_µs": 8940282, "decompress_µs": 450754, "total_µs": 9391036}, "status": "discard", "description": "Eight adaptive high residual bits per slot [lzma_coder.rs: DIST_TOP_BITS; matching generic DP distance prices]", "segment": 4, "agent": "codex-cli", "model": "gpt-6.1-sol (reasoning high)", "lane": "distance modeling (wave5-codex)"}
{"run": 69, "commit": "769ef0d", "metric": 0.199429, "metrics": {"compress_µs": 9190117, "decompress_µs": 421347, "total_µs": 9611464}, "status": "keep", "description": "REP0–REP7 with eight DP distances and MTF pricing [lzma_coder.rs: Model/encode/decode/rep test; lib.rs: Prices::from_lzma_stats/dp_parse rep state]", "segment": 4, "agent": "codex-cli", "model": "gpt-6.1-sol (reasoning high)", "lane": "distance modeling (wave5-codex)"}
{"run": 70, "commit": "769ef0d", "metric": 0.199401, "metrics": {"compress_µs": 9154601, "decompress_µs": 428654, "total_µs": 9583255}, "status": "keep", "description": "Price learned shared low-four-bit align distribution [lib.rs: Prices::from_lzma_stats/dp_parse distance residual prices]", "segment": 4, "agent": "codex-cli", "model": "gpt-6.1-sol (reasoning high)", "lane": "distance modeling (wave5-codex)"}
{"run": 71, "commit": "769ef0d", "metric": 0.199307, "metrics": {"compress_µs": 8896136, "decompress_µs": 403628, "total_µs": 9299764}, "status": "keep", "description": "Align model context by distance exponent [lzma_coder.rs: Model/encode/decode/align_context; lib.rs: Prices::from_lzma_stats/dp_parse]", "segment": 4, "agent": "codex-cli", "model": "gpt-6.1-sol (reasoning high)", "lane": "distance modeling (wave5-codex)"}
{"run": 72, "commit": "-", "metric": 0.199314, "metrics": {"compress_µs": 11131070, "decompress_µs": 462981, "total_µs": 11594051}, "status": "discard", "description": "Binary-tree-smoothed top/align prices [lib.rs: Prices::from_lzma_stats tree_prices]", "segment": 4, "agent": "codex-cli", "model": "gpt-6.1-sol (reasoning high)", "lane": "distance modeling (wave5-codex)"}
{"run": 73, "commit": "769ef0d", "metric": 0.199268, "metrics": {"compress_µs": 8830132, "decompress_µs": 401856, "total_µs": 9231988}, "status": "keep", "description": "Slower adaptation of high residual bits (shift +1) [lzma_coder.rs: distance_top_enc/dec/upd_distance_top]", "segment": 4, "agent": "codex-cli", "model": "gpt-6.1-sol (reasoning high)", "lane": "distance modeling (wave5-codex)"}
{"run": 74, "commit": "769ef0d", "metric": 0.199155, "metrics": {"compress_µs": 9366443, "decompress_µs": 426468, "total_µs": 9792911}, "status": "keep", "description": "Eight high residual bits with slower adaptation [lzma_coder.rs: DIST_TOP_BITS (generic distance prices)]", "segment": 4, "agent": "codex-cli", "model": "gpt-6.1-sol (reasoning high)", "lane": "distance modeling (wave5-codex)"}
{"run": 75, "commit": "769ef0d", "metric": 0.199151, "metrics": {"compress_µs": 9391468, "decompress_µs": 414981, "total_µs": 9806449}, "status": "keep", "description": "High residual adaptation shift +2 [lzma_coder.rs: upd_distance_top]", "segment": 4, "agent": "codex-cli", "model": "gpt-6.1-sol (reasoning high)", "lane": "distance modeling (wave5-codex)"}
{"run": 76, "commit": "-", "metric": 0.199343, "metrics": {"compress_µs": 8943318, "decompress_µs": 383405, "total_µs": 9326723}, "status": "discard", "description": "Slot mixture: 75% length, 25% previous-distance bucket [lzma_coder.rs: distance_slot_enc/dec; lib.rs: Prices::from_lzma_stats/dp_parse mixed slot prices]", "segment": 4, "agent": "codex-cli", "model": "gpt-6.1-sol (reasoning high)", "lane": "distance modeling (wave5-codex)"}
{"run": 77, "commit": "-", "metric": 0.199381, "metrics": {"compress_µs": 9991602, "decompress_µs": 432497, "total_µs": 10424099}, "status": "discard", "description": "Slot mixture: 87.5% length, 12.5% previous-distance bucket [lzma_coder.rs: distance_slot_enc/dec; lib.rs: mixed distance slot prices]", "segment": 4, "agent": "codex-cli", "model": "gpt-6.1-sol (reasoning high)", "lane": "distance modeling (wave5-codex)"}
{"run": 78, "commit": "769ef0d", "metric": 0.199055, "metrics": {"compress_µs": 9613623, "decompress_µs": 421133, "total_µs": 10034756}, "status": "keep", "description": "REP0–REP15 with generic cache and full-index test [lzma_coder.rs: REP_COUNT/encode/decode/test; lib.rs: Prices/dp_parse rep arrays]", "segment": 4, "agent": "codex-cli", "model": "gpt-6.1-sol (reasoning high)", "lane": "distance modeling (wave5-codex)"}
{"run": 79, "commit": "769ef0d", "metric": 0.199054, "metrics": {"compress_µs": 10740284, "decompress_µs": 428212, "total_µs": 11168496}, "status": "keep", "description": "REP0–REP31 [lzma_coder.rs: REP_COUNT; generic encoder/decoder/DP/prices/test]", "segment": 4, "agent": "codex-cli", "model": "gpt-6.1-sol (reasoning high)", "lane": "distance modeling (wave5-codex)"}
{"run": 80, "commit": "769ef0d", "metric": 0.199008, "metrics": {"compress_µs": 11657250, "decompress_µs": 458708, "total_µs": 12115958}, "status": "keep", "description": "REP0–REP63 [lzma_coder.rs: REP_COUNT; generic encoder/decoder/DP/prices/test]", "segment": 4, "agent": "codex-cli", "model": "gpt-6.1-sol (reasoning high)", "lane": "distance modeling (wave5-codex)"}
{"run": 81, "commit": "-", "metric": 0.199147, "metrics": {"compress_µs": 13733964, "decompress_µs": 443071, "total_µs": 14177035}, "status": "discard", "description": "REP0–REP127 [lzma_coder.rs: REP_COUNT; generic encoder/decoder/DP/prices/test]", "segment": 4, "agent": "codex-cli", "model": "gpt-6.1-sol (reasoning high)", "lane": "distance modeling (wave5-codex)"}
{"run": 82, "commit": "769ef0d", "metric": 0.198989, "metrics": {"compress_µs": 10871429, "decompress_µs": 405346, "total_µs": 11276775}, "status": "keep", "description": "Bayesian high-bit mixture: uniform + KT; shared predictor pricing [lzma_coder.rs: DistanceTop/Model/encode/decode; lib.rs: Prices::from_lzma_stats top model replay]", "segment": 4, "agent": "codex-cli", "model": "gpt-6.1-sol (reasoning high)", "lane": "distance modeling (wave5-codex)"}
{"run": 83, "commit": "769ef0d", "metric": 0.198826, "metrics": {"compress_µs": 11284963, "decompress_µs": 426682, "total_µs": 11711645}, "status": "keep", "description": "Bias-model prior weight 1/8 [lzma_coder.rs: DistanceTop::new (shared by encoder/decoder/pricing)]", "segment": 4, "agent": "codex-cli", "model": "gpt-6.1-sol (reasoning high)", "lane": "distance modeling (wave5-codex)"}
{"run": 84, "commit": "769ef0d", "metric": 0.198729, "metrics": {"compress_µs": 11910883, "decompress_µs": 500061, "total_µs": 12410944}, "status": "keep", "description": "Bias-model prior weight 1/32 [lzma_coder.rs: DistanceTop::new (shared encoder/decoder/pricing)]", "segment": 4, "agent": "codex-cli", "model": "gpt-6.1-sol (reasoning high)", "lane": "distance modeling (wave5-codex)"}
