{"run": 85, "commit": "-", "metric": 0.198754, "metrics": {"compress_µs": 11037812, "decompress_µs": 415137, "total_µs": 11452949}, "status": "discard", "description": "Bias-model prior weight 1/128 [lzma_coder.rs: DistanceTop::new (shared encoder/decoder/pricing)]", "segment": 4, "agent": "codex-cli", "model": "gpt-6.1-sol (reasoning high)", "lane": "distance modeling (wave5-codex)"}
{"run": 86, "commit": "-", "metric": 0.198741, "metrics": {"compress_µs": 10907814, "decompress_µs": 401570, "total_µs": 11309384}, "status": "discard", "description": "Twelve Bayesian high residual bits; heap price tables [lzma_coder.rs: DIST_TOP_BITS; lib.rs: Prices dist_top storage]", "segment": 4, "agent": "codex-cli", "model": "gpt-6.1-sol (reasoning high)", "lane": "distance modeling (wave5-codex)"}
{"run": 87, "commit": "769ef0d", "metric": 0.198688, "metrics": {"compress_µs": 10859247, "decompress_µs": 397225, "total_µs": 11256472}, "status": "keep", "description": "Rep-selector tree prices with binary priors and probability limits [lib.rs: Prices::from_lzma_stats rep selection costs]", "segment": 4, "agent": "codex-cli", "model": "gpt-6.1-sol (reasoning high)", "lane": "distance modeling (wave5-codex)"}
{"run": 88, "commit": "-", "metric": 0.198723, "metrics": {"compress_µs": 10482288, "decompress_µs": 381533, "total_µs": 10863821}, "status": "discard", "description": "Price small-distance modeled residuals by slot [lib.rs: Prices::from_lzma_stats/dp_parse small-distance prices]", "segment": 4, "agent": "codex-cli", "model": "gpt-6.1-sol (reasoning high)", "lane": "distance modeling (wave5-codex)"}
{"run": 89, "commit": "-", "metric": 0.198732, "metrics": {"compress_µs": 10633034, "decompress_µs": 405685, "total_µs": 11038719}, "status": "discard", "description": "Pool REP3+ tail selector across states; global tail pricing [lzma_coder.rs: Model/encode/decode rep_tail; lib.rs: Prices::from_lzma_stats tail counts]", "segment": 4, "agent": "codex-cli", "model": "gpt-6.1-sol (reasoning high)", "lane": "distance modeling (wave5-codex)"}
{"run": 90, "commit": "7ee8804", "metric": 0.182259, "metrics": {"compress_µs": 28943188, "decompress_µs": 1740268, "total_µs": 30683456}, "status": "keep", "description": "Wave 5 merge: wave5-gemini + wave5-claude on main, measured serially (compress 3.6x, decompress 4.7x vs baseline). wave5-codex (0.198688 alone) not merged: conflicts with Gemini DP rep/lctx pricing", "timestamp": 1791057098000, "segment": 4, "agent": "claude-code", "model": "claude-opus-5-5", "lane": "orchestrator"}
