{"type":"config","name":"lz77-optimize","metricName":"total_µs","metricUnit":"µs","bestDirection":"lower"}
{"run": 1, "commit": "209eb2b", "metric": 12993, "metrics": {"compress_µs": 12588, "decompress_µs": 405, "ratio": 0.75046}, "status": "keep", "description": "Baseline: hash-chain LZ77, greedy matching, 32KB window", "timestamp": 1773436683730, "segment": 0, "agent": "claude-code", "model": "claude-opus-4-6"}
{"run": 2, "commit": "a4ad6e9", "metric": 12973, "metrics": {"compress_µs": 12562, "decompress_µs": 411, "ratio": 0.75046}, "status": "keep", "description": "Add LTO, codegen-units=1, panic=abort to release profile", "timestamp": 1773436710090, "segment": 0, "agent": "claude-code", "model": "claude-opus-4-6"}
{"run": 3, "commit": "a4ad6e9", "metric": 13196, "metrics": {"compress_µs": 12831, "decompress_µs": 365, "ratio": 0.43324}, "status": "discard", "description": "Literal run encoding + compact match format (MAX_MATCH 130). Huge ratio win (0.75→0.43) but total_µs slightly worse due to flush overhead and shorter max match", "timestamp": 1773436798904, "segment": 0, "agent": "claude-code", "model": "claude-opus-4-6"}
{"run": 4, "commit": "e854bc2", "metric": 8406, "metrics": {"compress_µs": 7980, "decompress_µs": 426, "ratio": 0.772094}, "status": "keep", "description": "Reduce MAX_CHAIN from 256 to 64 — 35% faster compression, ratio slightly worse (0.75→0.77)", "timestamp": 1773436833756, "segment": 0, "agent": "claude-code", "model": "claude-opus-4-6"}
{"run": 5, "commit": "2b7aceb", "metric": 5288, "metrics": {"compress_µs": 4859, "decompress_µs": 429, "ratio": 0.809725}, "status": "keep", "description": "Reduce MAX_CHAIN from 64 to 32 — another 37% faster, ratio 0.77→0.81", "timestamp": 1773436859138, "segment": 0, "agent": "claude-code", "model": "claude-opus-4-6"}
{"run": 6, "commit": "2b7aceb", "metric": 5348, "metrics": {"compress_µs": 4716, "decompress_µs": 632, "ratio": 0.865937}, "status": "discard", "description": "MAX_CHAIN=16 — compress slightly faster but decompress much slower due to worse ratio (0.81→0.87). Net worse.", "timestamp": 1773436892987, "segment": 0, "agent": "claude-code", "model": "claude-opus-4-6"}
{"run": 7, "commit": "2149c34", "metric": 4665, "metrics": {"compress_µs": 4239, "decompress_µs": 426, "ratio": 0.809725}, "status": "keep", "description": "Use u64 word-at-a-time comparison in match finding — 12% faster compression", "timestamp": 1773436930037, "segment": 0, "agent": "claude-code", "model": "claude-opus-4-6"}
{"run": 8, "commit": "1dd0c5f", "metric": 5631, "metrics": {"compress_µs": 5005, "decompress_µs": 626, "ratio": 0.868153}, "status": "discard", "description": "Skip hash insertions (every 3rd pos) — worse ratio tanks overall speed. Hash insertion not the bottleneck.", "timestamp": 1773437080619, "segment": 0, "agent": "claude-code", "model": "claude-opus-4-6"}
{"run": 9, "commit": "30137fc", "metric": 4948, "metrics": {"compress_µs": 4492, "decompress_µs": 456, "ratio": 0.809758}, "status": "keep", "description": "Multiplicative hash (0x1E35A7BD) — better distribution, ~6% faster than shift-XOR", "timestamp": 1773437157478, "segment": 0, "agent": "claude-code", "model": "claude-opus-4-6"}
{"run": 10, "commit": "30137fc", "metric": 6085, "metrics": {"compress_µs": 5531, "decompress_µs": 554, "ratio": 0.809758}, "status": "discard", "description": "Double quick-reject (byte 0 + best_len) — redundant with hash, adds branch penalty", "timestamp": 1773437200348, "segment": 0, "agent": "claude-code", "model": "claude-opus-4-6"}
{"run": 11, "commit": "71c73b2", "metric": 4399, "metrics": {"compress_µs": 4002, "decompress_µs": 397, "ratio": 0.809758}, "status": "keep", "description": "Unsafe match copy in decompressor — eliminates per-byte bounds checks, ~10% faster overall", "timestamp": 1773437241061, "segment": 0, "agent": "claude-code", "model": "claude-opus-4-6"}
{"run": 12, "commit": "9c838e5", "metric": 4017, "metrics": {"compress_µs": 3625, "decompress_µs": 392, "ratio": 0.777605}, "status": "keep", "description": "4-byte hash (u32 read + multiply) — fewer collisions, better ratio (0.81→0.78) AND 9% faster", "timestamp": 1773437316902, "segment": 0, "agent": "claude-code", "model": "claude-opus-4-6"}
{"run": 13, "commit": "d81bca8", "metric": 3803, "metrics": {"compress_µs": 3440, "decompress_µs": 363, "ratio": 0.777605}, "status": "keep", "description": "Unsafe unchecked hash insertion (get_unchecked_mut) — eliminates bounds checks in hot loop, ~5% faster", "timestamp": 1773437385705, "segment": 0, "agent": "claude-code", "model": "claude-opus-4-6"}
{"run": 14, "commit": "5cbb92a", "metric": 3749, "metrics": {"compress_µs": 3370, "decompress_µs": 379, "ratio": 0.777605}, "status": "keep", "description": "Unsafe unchecked access in find_best_match — raw ptr for all data/head/prev accesses, ~1-2% faster", "timestamp": 1773437427744, "segment": 0, "agent": "claude-code", "model": "claude-opus-4-6"}
{"run": 15, "commit": "5cbb92a", "metric": 3851, "metrics": {"compress_µs": 3465, "decompress_µs": 386, "ratio": 0.777605}, "status": "discard", "description": "target-cpu=native — no measurable improvement on Apple Silicon", "timestamp": 1773437461003, "segment": 0, "agent": "claude-code", "model": "claude-opus-4-6"}
{"run": 16, "commit": "76474a2", "metric": 4089, "metrics": {"compress_µs": 3692, "decompress_µs": 397, "ratio": 0.682971}, "status": "discard", "description": "4-byte match encoding (5→4 bytes) — great ratio (0.68) but speed worse. Primary metric is speed.", "timestamp": 1773437608107, "segment": 0, "agent": "claude-code", "model": "claude-opus-4-6"}
{"run": 17, "commit": "5230963", "metric": 3533, "metrics": {"compress_µs": 3166, "decompress_µs": 367, "ratio": 0.777605}, "status": "keep", "description": "Batch match output with extend_from_slice — one memcpy instead of 5 pushes, ~11% faster", "timestamp": 1773437677997, "segment": 0, "agent": "claude-code", "model": "claude-opus-4-6"}
{"run": 18, "commit": "84e9f0d", "metric": 3580, "metrics": {"compress_µs": 3206, "decompress_µs": 374, "ratio": 0.777605}, "status": "discard", "description": "extend_from_slice for 2-byte literal — no improvement over 2 pushes (within noise)", "timestamp": 1773437722244, "segment": 0, "agent": "claude-code", "model": "claude-opus-4-6"}
{"run": 19, "commit": "b846813", "metric": 3842, "metrics": {"compress_µs": 3474, "decompress_µs": 368, "ratio": 0.778358}, "status": "discard", "description": "HASH_BITS 15→14 (smaller table) — more collisions, net slower despite better cache", "timestamp": 1773437779880, "segment": 0, "agent": "claude-code", "model": "claude-opus-4-6"}
{"run": 20, "commit": "b846813", "metric": 4681, "metrics": {"compress_µs": 4180, "decompress_µs": 501, "ratio": 0.777553}, "status": "discard", "description": "HASH_BITS 15→16 — fewer collisions but more cache misses, net worse", "timestamp": 1773437817451, "segment": 0, "agent": "claude-code", "model": "claude-opus-4-6"}
{"run": 21, "commit": "b846813", "metric": 3694, "metrics": {"compress_µs": 3284, "decompress_µs": 410, "ratio": 0.812635}, "status": "discard", "description": "Only insert first match position — saves hash computation but worse ratio tanks overall speed", "timestamp": 1773437864126, "segment": 0, "agent": "claude-code", "model": "claude-opus-4-6"}
{"type":"config","name":"lz77-optimize-libdeflate-corpus","metricName":"total_µs","metricUnit":"µs","bestDirection":"lower"}
{"run": 1, "commit": "a568880", "metric": 19767, "metrics": {"compress_µs": 17192, "decompress_µs": 2575, "ratio": 0.753886}, "status": "keep", "description": "Baseline with LibDeflate corpus (2.76MB, 10 files). Already has: MAX_CHAIN=32, 4-byte multiplicative hash, u64 match comparison, unsafe unchecked access, extend_from_slice matches, unsafe decompress copy.", "timestamp": 1773439420373, "segment": 1, "agent": "claude-code", "model": "claude-opus-4-6"}
{"run": 2, "commit": "0e608d8", "metric": 19288, "metrics": {"compress_µs": 16735, "decompress_µs": 2553, "ratio": 0.753907}, "status": "keep", "description": "Skip hashing in incompressible regions (miss_streak >= 128) — JPEG 1264→350µs, ~2.5% overall faster", "timestamp": 1773439468077, "segment": 1, "agent": "claude-code", "model": "claude-opus-4-6"}
{"run": 3, "commit": "0e608d8", "metric": 19505, "metrics": {"compress_µs": 16889, "decompress_µs": 2616, "ratio": 0.75396}, "status": "discard", "description": "SKIP_THRESHOLD 128→64 — triggers skip too early on semi-compressible data like plrabn12", "timestamp": 1773439510179, "segment": 1, "agent": "claude-code", "model": "claude-opus-4-6"}
{"run": 4, "commit": "c134e80", "metric": 19047, "metrics": {"compress_µs": 16466, "decompress_µs": 2581, "ratio": 0.753907}, "status": "keep", "description": "Non-overlapping match copy with copy_nonoverlapping — faster decompression for large non-overlapping matches", "timestamp": 1773439551032, "segment": 1, "agent": "claude-code", "model": "claude-opus-4-6"}
{"run": 5, "commit": "c134e80", "metric": 21420, "metrics": {"compress_µs": 18475, "decompress_µs": 2945, "ratio": 0.754385}, "status": "discard", "description": "Early termination at match ≥ 32 — extra branch on hot path hurts more than it helps with MAX_CHAIN=32", "timestamp": 1773439615412, "segment": 1, "agent": "claude-code", "model": "claude-opus-4-6"}
{"run": 6, "commit": "c134e80", "metric": 19673, "metrics": {"compress_µs": 17052, "decompress_µs": 2621, "ratio": 0.753907}, "status": "discard", "description": "Fully unsafe decompressor (raw ptr reads) — no improvement, branch prediction already good", "timestamp": 1773439718369, "segment": 1, "agent": "claude-code", "model": "claude-opus-4-6"}
{"run": 7, "commit": "dd24e50", "metric": 19259, "metrics": {"compress_µs": 16679, "decompress_µs": 2580, "ratio": 0.753907}, "status": "discard", "description": "Remove output.reserve(length) in decompress — no effect, already pre-allocated", "timestamp": 1773439769832, "segment": 1, "agent": "claude-code", "model": "claude-opus-4-6"}
{"run": 8, "commit": "dd24e50", "metric": 19291, "metrics": {"compress_µs": 16656, "decompress_µs": 2635, "ratio": 0.753907}, "status": "discard", "description": "LTO + codegen-units=1 — no measurable improvement on single-crate project", "timestamp": 1773439816596, "segment": 1, "agent": "claude-code", "model": "claude-opus-4-6"}
{"run": 9, "commit": "dd24e50", "metric": 20705, "metrics": {"compress_µs": 17914, "decompress_µs": 2791, "ratio": 0.753907}, "status": "discard", "description": "MIN_MATCH 3→4 — same output (3-byte matches already marginal with 5-byte tokens) but slower", "timestamp": 1773439866268, "segment": 1, "agent": "claude-code", "model": "claude-opus-4-6"}
{"run": 10, "commit": "dd24e50", "metric": 20764, "metrics": {"compress_µs": 17818, "decompress_µs": 2946, "ratio": 0.451579}, "status": "discard", "description": "Compact multi-tier format (literal runs + 2/3/4-byte matches) — ratio 0.75→0.45 amazing but speed 8% worse", "timestamp": 1773439975615, "segment": 1, "agent": "claude-code", "model": "claude-opus-4-6"}
{"run": 11, "commit": "64a0fa1", "metric": 21886, "metrics": {"compress_µs": 19136, "decompress_µs": 2750, "ratio": 0.753907}, "status": "discard", "description": "Box<[u32]> instead of Vec<u32> for head/prev — no benefit, possibly worse cache behavior", "timestamp": 1773440248770, "segment": 1, "agent": "claude-code", "model": "claude-opus-4-6"}
{"run": 12, "commit": "64a0fa1", "metric": 19106, "metrics": {"compress_µs": 16501, "decompress_µs": 2605, "ratio": 0.753911}, "status": "discard", "description": "Skip 2 bytes at a time in incompressible regions — helps JPEG but negligible overall", "timestamp": 1773440296443, "segment": 1, "agent": "claude-code", "model": "claude-opus-4-6"}
{"run": 13, "commit": "64a0fa1", "metric": 19405, "metrics": {"compress_µs": 16716, "decompress_µs": 2689, "ratio": 0.753907}, "status": "discard", "description": "Raw output pointer with macros — compiler already optimizes push/extend, no improvement", "timestamp": 1773440362858, "segment": 1, "agent": "claude-code", "model": "claude-opus-4-6"}
{"run": 14, "commit": "c7a1171", "metric": 18191, "metrics": {"compress_µs": 15574, "decompress_µs": 2617, "ratio": 0.755302}, "status": "keep", "description": "MAX_CHAIN 32→24 — 4.5% faster overall, compress 7% faster, ratio negligibly worse (0.754→0.755)", "timestamp": 1773440394517, "segment": 1, "agent": "claude-code", "model": "claude-opus-4-6"}
{"run": 15, "commit": "c7a1171", "metric": 18461, "metrics": {"compress_µs": 15705, "decompress_µs": 2756, "ratio": 0.75642}, "status": "discard", "description": "MAX_CHAIN 24→20 — compress slightly faster but worse ratio makes decompress slower, net worse", "timestamp": 1773440431984, "segment": 1, "agent": "claude-code", "model": "claude-opus-4-6"}
{"run": 16, "commit": "d96880f", "metric": 0, "metrics": {"compress_µs": 0, "decompress_µs": 0, "ratio": 0}, "status": "crash", "description": "WINDOW_SIZE 32K→64K — distance overflow: 65536 wraps to 0 in 2-byte encoding", "timestamp": 1773441173501, "segment": 1, "agent": "claude-code", "model": "claude-opus-4-6"}
{"run": 17, "commit": "d96880f", "metric": 0, "metrics": {"compress_µs": 0, "decompress_µs": 0, "ratio": 0}, "status": "crash", "description": "aarch64 prefetch intrinsic — unstable feature, doesn't compile on stable Rust", "timestamp": 1773441213286, "segment": 1, "agent": "claude-code", "model": "claude-opus-4-6"}
{"run": 18, "commit": "d96880f", "metric": 18760, "metrics": {"compress_µs": 16035, "decompress_µs": 2725, "ratio": 0.755302}, "status": "discard", "description": "Hoist next chain pointer read before comparison — compiler already does this, no benefit", "timestamp": 1773441272424, "segment": 1, "agent": "claude-code", "model": "claude-opus-4-6"}
{"run": 19, "commit": "d96880f", "metric": 25535, "metrics": {"compress_µs": 22810, "decompress_µs": 2725, "ratio": 0.758315}, "status": "discard", "description": "XOR-shift hash — terrible distribution, kennedy.xls doubled in time. Multiplicative hash is far better.", "timestamp": 1773441310352, "segment": 1, "agent": "claude-code", "model": "claude-opus-4-6"}
{"run": 20, "commit": "d96880f", "metric": 18446, "metrics": {"compress_µs": 15733, "decompress_µs": 2713, "ratio": 0.757208}, "status": "discard", "description": "Rep-distance fast path (threshold 8) — kennedy.xls 33% faster but ratio penalty on text files cancels gains", "timestamp": 1773441660156, "segment": 1, "agent": "claude-code", "model": "claude-opus-4-6", "idea_from": "gpt-5.4 (codex)"}
{"run": 21, "commit": "d96880f", "metric": 0, "metrics": {"compress_µs": 0, "decompress_µs": 0, "ratio": 0}, "status": "crash", "description": "LZ77+Huffman full rewrite — decode table index out of bounds, needs debugging", "timestamp": 1773442072643, "segment": 1, "agent": "claude-code", "model": "claude-opus-4-6", "idea_from": "gpt-5.4 (codex)"}
{"run": 22, "commit": "0a925d0", "metric": 20630, "metrics": {"compress_µs": 17564, "decompress_µs": 3066, "ratio": 0.451912}, "status": "keep", "description": "Compact format: literal runs + 2/3/4-byte matches. Ratio 0.755→0.452 (-40%!). JPEG barely expands (1.007). Speed 13% slower but dramatically better compression.", "timestamp": 1773442184959, "segment": 1, "agent": "claude-code", "model": "claude-opus-4-6"}
{"run": 23, "commit": "577434b", "metric": 20477, "metrics": {"compress_µs": 17426, "decompress_µs": 3051, "ratio": 0.451912}, "status": "keep", "description": "Refactor decompress: factored copy_match, unsafe tag reads, cleaner structure. ~Same speed.", "timestamp": 1773442242164, "segment": 1, "agent": "claude-code", "model": "claude-opus-4-6"}
{"run": 24, "commit": "d96880f", "metric": 28205, "metrics": {"compress_µs": 25136, "decompress_µs": 3069, "ratio": 0.451152}, "status": "discard", "description": "Lazy matching — ratio 0.451→0.451 (negligible) but compress 55% slower. Double find_best_match too expensive.", "timestamp": 1773442284433, "segment": 1, "agent": "claude-code", "model": "claude-opus-4-6"}
{"run": 25, "commit": "f723d9f", "metric": 21380, "metrics": {"compress_µs": 18248, "decompress_µs": 3132, "ratio": 0.451579}, "status": "discard", "description": "MAX_CHAIN 24→32 with compact format — marginal ratio gain (0.4519→0.4516), speed 3.5% worse", "timestamp": 1773442778315, "segment": 1, "agent": "claude-code", "model": "claude-opus-4-6"}
{"run": 26, "commit": "6757f87", "metric": 21037, "metrics": {"compress_µs": 17848, "decompress_µs": 3189, "ratio": 0.451912}, "status": "discard", "description": "Remove output.reserve in copy_match — no effect, already pre-allocated", "timestamp": 1773442899920, "segment": 1, "agent": "claude-code", "model": "claude-opus-4-6"}
{"run": 27, "commit": "2c0b362", "metric": 25586, "metrics": {"compress_µs": 21154, "decompress_µs": 4432, "ratio": 0.422625}, "status": "keep", "description": "LZ77+Huffman: ratio 0.452→0.423 (-6.5%). Bitstream encoding of Huffman literals + fixed-width matches. Speed 24% slower — needs optimization.", "timestamp": 1773444582837, "segment": 1, "agent": "claude-code", "model": "claude-opus-4-6", "idea_from": "gpt-5.4 (codex, Huffman code)"}
{"run": 28, "commit": "2c0b362", "metric": 27046, "metrics": {"compress_µs": 21491, "decompress_µs": 5555, "ratio": 0.422625}, "status": "discard", "description": "Bulk 7-byte refill in BitReader — mask computation overhead makes it slower than byte-at-a-time", "timestamp": 1773444642159, "segment": 1, "agent": "claude-code", "model": "claude-opus-4-6"}
{"run": 29, "commit": "5f8a6f8", "metric": 34890, "metrics": {"compress_µs": 28182, "decompress_µs": 6708, "ratio": 0.337186}, "status": "keep", "description": "DEFLATE-style combined lit/len+dist Huffman: ratio 0.423→0.337 (-20%!). kennedy.xls at 0.236. Speed 36% slower — bitstream + dual Huffman trees overhead.", "timestamp": 1773444775930, "segment": 1, "agent": "claude-code", "model": "claude-opus-4-6", "idea_from": "gpt-5.4 (codex)"}
{"run": 30, "commit": "316c0f8", "metric": 28309, "metrics": {"compress_µs": 23361, "decompress_µs": 4948, "ratio": 0.337186}, "status": "keep", "description": "Eager BitReader refill (always fill to 24+ bits) — decompress 26% faster, total 19% faster", "timestamp": 1773445443721, "segment": 1, "agent": "claude-code", "model": "claude-opus-4-6"}
{"run": 31, "commit": "316c0f8", "metric": 28532, "metrics": {"compress_µs": 23302, "decompress_µs": 5230, "ratio": 0.337186}, "status": "discard", "description": "4-byte flush in BitWriter — no improvement, compiler already optimizes byte loop", "timestamp": 1773445511210, "segment": 1, "agent": "claude-code", "model": "claude-opus-4-6"}
{"run": 32, "commit": "8174d1f", "metric": 27708, "metrics": {"compress_µs": 22646, "decompress_µs": 5062, "ratio": 0.337761}, "status": "keep", "description": "MAX_CHAIN 24→16 with Huffman — compress faster, ratio nearly identical (Huffman compensates for shorter chains)", "timestamp": 1773445560017, "segment": 1, "agent": "claude-code", "model": "claude-opus-4-6"}
{"run": 33, "commit": "f35fb13", "metric": 26017, "metrics": {"compress_µs": 21049, "decompress_µs": 4968, "ratio": 0.338324}, "status": "keep", "description": "MAX_CHAIN 16→12 — 6% faster, ratio unchanged (0.3383 vs 0.3378). Huffman compensates well.", "timestamp": 1773445602228, "segment": 1, "agent": "claude-code", "model": "claude-opus-4-6"}
{"run": 34, "commit": "8d37a6c", "metric": 24371, "metrics": {"compress_µs": 19269, "decompress_µs": 5102, "ratio": 0.339811}, "status": "keep", "description": "MAX_CHAIN 12→8 — another 6% faster, ratio still 0.34. Compress approaching original LZ77 speed.", "timestamp": 1773445626181, "segment": 1, "agent": "claude-code", "model": "claude-opus-4-6"}
{"run": 35, "commit": "8d37a6c", "metric": 24213, "metrics": {"compress_µs": 18923, "decompress_µs": 5290, "ratio": 0.341199}, "status": "discard", "description": "MAX_CHAIN=6 marginal (24213 vs 24371). MAX_CHAIN=4 worse (25322). MAX_CHAIN=8 is the sweet spot.", "timestamp": 1773445679803, "segment": 1, "agent": "claude-code", "model": "claude-opus-4-6"}
{"run": 36, "commit": "a4abe3b", "metric": 104692, "metrics": {"compress_µs": 99468, "decompress_µs": 5224, "ratio": 0.315114}, "status": "keep", "description": "Optimal parsing (forward DP): ratio 0.340→0.315 (-7.4%). kennedy.xls 0.236→0.184. Compress 5x slower due to DP over full input — needs block-based processing.", "timestamp": 1773446222046, "segment": 1, "agent": "claude-code", "model": "claude-opus-4-6", "idea_from": "gpt-5.4 (codex) + gemini-3-flash-preview"}
{"run": 37, "commit": "65f20cc", "metric": 102273, "metrics": {"compress_µs": 97149, "decompress_µs": 5124, "ratio": 0.312834}, "status": "keep", "description": "Combined match-finding+DP in single pass — same ratio (0.313), eliminates 11MB temp arrays. Decompress 5.1ms (improved from 6.2ms).", "timestamp": 1773446669378, "segment": 1, "agent": "claude-code", "model": "claude-opus-4-6"}
{"run": 38, "commit": "117fe68", "metric": 171795, "metrics": {"compress_µs": 166439, "decompress_µs": 5356, "ratio": 0.309405}, "status": "keep", "description": "MAX_CHAIN 8→32 with DP — ratio 0.313→0.309 (-1.3%). kennedy.xls 0.179. Compress 66% slower but best ratio yet.", "timestamp": 1773446704941, "segment": 1, "agent": "claude-code", "model": "claude-opus-4-6"}
{"run": 39, "commit": "7eb7986", "metric": 223591, "metrics": {"compress_µs": 218541, "decompress_µs": 5050, "ratio": 0.308374}, "status": "keep", "description": "DP with 8 length candidates at DEFLATE boundaries — ratio 0.309→0.308. Marginal win, compress 34% slower.", "timestamp": 1773446753581, "segment": 1, "agent": "claude-code", "model": "claude-opus-4-6"}
